start|end|text
2797.9|2800.23|They had missed just about 20 crops, too.
2800.25|2804.71|They kept trying to grow crops, but couldn't make it.
2804.73|2818.61|Did you find that there was any prejudice around in your area, like people who had immigrated into, you know, people from Europe or different places, that people feel that there was enough to go around or not enough, and they weren't willing to care?
2818.63|2818.73|Well,
2825.72|2833.41|see, I don't know what you refer to when you say prejudices, people coming in from outside communities.
2833.81|2838.9|That was a normal thing, people moving around from areas, you know.
2838.92|2844.47|We were almost a strictly American Eastern Canadian settlement there.
2844.49|2851.66|And the first that we saw of anyone that had any what we call foreign blood in them is a bunch of
2853.29|2855.97|They would be from German extraction, I guess.
2856.24|2857.66|They came in from Maple Creek.
2857.94|2861.22|They had gone out in that area, and they totally dried out.
2861.3|2864.27|And they were some of the ones that came through with horses and wagons.
2864.85|2869.68|They'd come into our district, and if there's a vacant farm, they got on it.
2869.7|2873.8|And people, you know, you come there one year, there's one.
2873.82|2876.87|And three years, there's a half a dozen more.
2877.45|2881.42|So they finally come in, and now basically that's what's in the community.
2881.5|2883.38|Did people resent them coming in?
2883.5|2883.74|No.
2884.08|2884.16|No?
2884.18|2887.08|They treated them just the same as...
2887.1|2889.09|It was one of the things you accepted.
2889.11|2892.51|You felt sorry for the guy, you know.
2892.53|2895.29|It sounds to me like there was a real sense of neighborliness then.
2895.55|2898.59|Well, there had to be a case of survival.
2899.01|2901.78|That's how you did it.
2901.92|2906.74|Do you remember the church being very involved in any of the volunteers or anything?
2906.76|2906.82|No.
2907.43|2912.11|The church paid no attention to it whatever.
2912.97|2919.54|They had no, now I couldn't speak for, well I can speak for Esteban too.
2919.56|2924.86|I never saw anything organized there really, or Weyburn.
2925.14|2927.13|We're in a small community in Halbrite.
2927.21|2929.23|We're the only church between the two places.
2929.79|2936.96|But there's never anything done for the poor or anything, not like we're doing today.
2937.23|2939.03|in any of the churches there.
2939.05|2952.01|Of course, I suppose the churches is, you know, the people in the church didn't have any money either, so I suppose that would be... Well, the church is the people, put it that way.
2952.03|2952.19|Yeah.
2952.43|2954.55|Do you remember when it started to get better?
2958.5|2962.32|Well, yes, about 19...
2965.39|2967.83|42, let's see.
2967.85|2969.32|So after the war started, eh?
2969.34|2970.84|When the war started, yeah.
2970.86|2974.38|Then you could see things starting to pick up a little bit.
2974.4|2979.19|Did a lot of the young men go into war because they hadn't had a job, do you think?
2979.27|2980.13|Oh, yeah.
2980.17|2983.33|That was just like that, into the army.
2983.67|2985.55|Because it was a guaranteed wage.
2985.57|2987.08|Then relief was cut off.
2987.1|2988.28|It was harder to get relief.
2988.46|2989.42|Well, they cut off relief.
2989.46|2992.24|Married men and everybody into the army on those fellas'
2992.39|2995.3|I never joined the Army on the account of that.
2995.43|2996.42|I was a tradesman.
2996.52|3003.43|I was a journeyman electrician, and I could have gone into the Navy with a ranking.
3003.91|3007.38|And then I was just married two years, and Phyllis and I talked it over.
3007.39|3011.12|And I was tied to my job.
3012.64|3016.17|But you said they cut the relief off as soon as the war started?
3016.25|3018.67|Well, not immediately, but it soon followed them.
3018.69|3020.5|In other words, as a means of getting people into the army.
3020.52|3022.24|As fast as they could mobilize them.
3022.26|3022.74|Is that right?
3022.82|3024.66|Do you remember them having conscription?
3026.16|3026.6|Oh, yeah.
3026.62|3029.74|Well, I was up for conscription.
3029.8|3031.01|What did people feel about that?
3032.75|3033.71|Just the way it should be.
3033.89|3034.71|Is that right, eh?
3034.85|3035.35|Oh, yeah.
3035.37|3038.51|There weren't people, they didn't oppose to the idea of conscription at all?
3038.55|3039.77|No, I never heard anyone.
3040.43|3042.5|Because it was so different than that in the East.
3042.68|3045.06|A lot of people were really, really opposed to conscription.
3045.08|3045.6|Well, of course.
3047.17|3049.59|Well, we hadn't had a war just before that.
3049.63|3056.72|The World War was only 20 years old when this one had ended, only 20 years when this one, I think, one started.
3057.08|3060.32|You know, a lot of patriotism.
3060.34|3062.53|Down here.
3062.55|3064.97|More so than there is today, I think.
3064.99|3065.77|Yeah, well, that's the question.
3065.79|3066.51|Although we don't know.
3066.55|3068.8|If a war started now, you'd probably see it.
3068.82|3070.98|Yeah, but I think they had more links to Britain then.
3071.25|3078.88|People felt more, because Britain was at war, that Canada should go at war, too, because it was, you know, bad tie.
3079.07|3081.24|Well, I don't know if they would now, you know.
3081.26|3082.52|Canada's much more independent.
3083.02|3086.96|Well, a lot of them probably.
3087.64|3092.31|We haven't got unemployment yet, and it's not bad yet, you know.
3092.33|3096.93|You talk about unemployment, I'll get back to that when I was in Saskatoon in the spring of 31.
3097.87|3100.06|I saw lines of
3100.46|3104.91|Traveling men, travelers taken off of the road.
3104.93|3107.69|I don't know if they still have them or not.
3107.71|3112.66|The guys that used to go from town to town and take orders for things and sell things.
3112.68|3113.78|Like traveling salesmen.
3113.82|3115.42|From the wholesale houses.
3115.44|3115.54|Yeah.
3116.24|3127.24|I've seen lineups, two abreast, three city blocks long, waiting to get lined up down to the employment office or else the relief.
3127.8|3129.48|where they got relief.
3129.5|3136.93|That was the first guy that suffered was a fellow that was not out producing anything, you know.
3137.05|3137.89|He went first.
3138.55|3142.09|Now, I wouldn't be surprised to see that come again right now, you know.
3142.11|3143.59|They talk about unemployment now.
3143.61|3146.13|I said, "No, that's..."
3146.15|3150.92|I don't call that unemployment what we've got now, not what I see.
3150.94|3152.92|It's...
3153.02|3155.22|Conditions are so bad for it now.
3155.95|3157.03|When I went into this
3157.49|3160.9|small town of Tompkins to build a power line in the fall of 33.
3161.94|3170.76|In that small town there were about 300, maybe 275, 300 people living there.
3170.78|3172.32|And I went in there by myself.
3173.82|3176.74|And now I have to get a crew of eight, ten men.
3176.76|3180.71|I could have picked up 30 young men just like that in that small town.
3180.75|3182.01|Good young men.
3182.25|3185.58|I had to almost fight them off to keep them from working.
3186.25|3191.94|When did they start putting the power into these towns?
3191.96|3194.86|When did the government take over the Power Commission, did you say?
3194.88|3200.09|Well, the Power Commission started in 1928.
3200.59|3208.02|Do you think that they persisted with this and went through and took over all these corporations as a means of employment?
3209.33|3213.15|No, it was sort of a natural evolution.
3213.72|3242.78|uh it's funny you should ask that question I just finished reading a book by clinton white he's a university professor do you know him I want to phone him and congratulate him on on that book I read it from us I knew most of the people involved right from the time it was formed but I wasn't involved like he explained all the things that went on between the private companies and the power commission and how it all came about but it all happened whether
3243.02|3245.02|In Alberta, they didn't have a power commission.
3245.06|3246.62|The same thing happened in Alberta.
3246.64|3247.5|It's happened here.
3248.02|3255.23|Sort of a natural evolution, invention, economic conditions, and everything got right for it.
3255.25|3257.51|And it needed to be done, so they went ahead and did it.
3257.65|3263.7|It needed to be done, and they got new methods were evolved through the years.
3263.72|3264.9|And it all came about.
3265.86|3270.85|Tommy Douglas always said, we give all the farmers power.
3271.11|3292.24|well we'd have got power no matter if there's a liberal or conservative but what government was in regina uh when when they took over the ccf had just come in 1942 I think when they come in no but when who was in power over the over the depression oh
3292.48|3294.38|The Anderson government came in.
3294.6|3298.85|That was a conservative, or what do they call them, a united government.
3298.87|3299.45|Progressive.
3299.49|3300.43|Progressive.
3301.69|3303.01|They lasted four years.
3303.51|3313.14|They came in when things were just starting to get bad, and then they just got worse, and when they went out, they never got a seat in four years.
3314.04|3316.35|Now, that tells you that people are blaming the government.
3316.53|3317.79|Obviously, yeah.
3317.81|3319.43|You remember hearing about...
3319.83|3326.1|Bennett, just before the election, he promised a whole lot of things like employment insurance and all these kind of things?
3327.16|3335.85|Well, as I say, we were not as informed then, but I can remember that he was supposed to, when he came in, he was going to turn the whole world around, you know.
3337.71|3339.49|And in four years, nothing happened.
3339.51|3340.69|So people just gave up on him?
3340.71|3342.31|They just poured them out just like that.
3342.33|3345.93|But nothing happened after the liberal government came in either, did there?
3345.95|3348.04|No, it was the same thing.
3348.06|3349.2|Stalled, stalled.
3349.79|3352.73|They couldn't find answers until the war came.
3353.17|3355.93|I always say, give Hitler credit.
3356.59|3366.73|He put a stop to the Depression in North America, starting that war, and that made work.
3366.75|3372.59|And from there, we come back, and we build up, and now we've hit another dead end.
3372.84|3374.0|We'll probably have another war.
3374.42|3375.72|We could see it.
3376.3|3378.12|You could see this dead end coming.
3378.88|3382.02|I could see it for the last five years.
3382.16|3385.82|I've said, there's too much of everything.
3389.33|3392.21|We've out-manufactured ourselves.
3394.01|3394.7|It's all right.
3394.8|3397.18|Well, they say, well, people should buy more cars.
3398.64|3401.32|Yeah, you can only use so many cars.
3402.78|3406.71|But I could see it in my own
3407.11|3409.11|uneducated way in Regina here.
3409.65|3412.55|The used car lot, plug full, plug full.
3412.57|3422.08|Wherever you go, every small town, Waver and Estevan, the towns in between, all plugged full of used, good used cars, not junk cars, good used cars.
3422.16|3425.15|So they reach the saturation points.
3426.13|3427.13|Go through the stores.
3427.19|3433.45|The stores are plugged so full of merchandise, and they're still packing it in there more and more all the time.
3434.35|3435.43|Our own home here.
3435.83|3437.79|Closed closets, everything plugged right full.
3437.83|3438.99|You couldn't put any more in.
3439.79|3442.16|That's different than during the Depression, too, isn't it?
3442.18|3446.3|Because people tended to value things more, you know, keep them longer.
3446.54|3449.09|Well, everybody does as the Joneses do.
3449.11|3450.47|You wore the same suit.
3450.49|3455.92|This fella said her dad probably wore the same overcoat for 10, 15 years.
3456.82|3459.61|Today, if a guy did that, you'd say, what's wrong with that guy?
3459.63|3460.81|He can't buy new owner equipment.
3460.99|3464.45|But no, it's not strange because it was the same as everybody else's.
3464.47|3465.94|Sure, everybody else is doing the same.
3467.08|3467.54|Except you.
3470.08|3471.28|You were living very well.
3471.61|3474.77|Well, I didn't live extravagantly.
3474.83|3485.89|I say now, though, in those years when I was a migrant lineman, I had a suitcase, a club bag, and I could put the rest of the stuff in a cart.
3486.51|3488.51|that I owned.
3488.91|3490.69|You kept yourself down to the basics.
3490.71|3493.67|You always had a good suit, an extra pair of pants.
3494.01|3495.22|You didn't have two jackets.
3496.58|3498.54|When you wore the pants, you wore a sweater with them.
3498.86|3501.6|That's easy to pack, you know.
3502.28|3505.62|And a good pair of dress shoes, and that was, that's all.
3506.16|3508.05|Yeah, nobody had any frills or anything.
3508.07|3509.47|They just had the bare necessities.
3509.49|3511.59|That's right, and that's where you lived.
3512.39|3516.51|Do you think that living during the Depression has affected anything that you
3517.05|3517.59|Do now?
3518.01|3518.41|Everything.
3519.59|3519.8|How?
3520.38|3520.74|Save.
3522.8|3523.3|You save.
3523.48|3526.5|I'm still frugal on everything I do.
3528.35|3531.21|And that was just because you were, that was the way you did.
3531.23|3532.01|That's the way I was.
3532.09|3533.61|And you saved during the Depression.
3535.18|3537.54|Sure, I saved during the Depression when things were tough.
3537.56|3538.02|I saved.
3538.04|3538.84|You always save.
3538.98|3545.51|So that was just sort of a form of, your form of security, your way of handling them in case you got laid off or something like that, was it?
3545.53|3545.91|Yeah, that's right.
3546.4|3550.92|Same when I started my own business, when I started contracting.
3550.94|3557.81|I always never went ahead until I saw the finances on my own.
3557.83|3562.15|I didn't go to the banker and say, here, I've got to have $10,000 to do this or that.
3562.17|3567.08|I'd wait until I had the $10,000, and then I'd make my move.
3567.1|3572.4|In other words, you never knew when it was going to stop all through the 20 years that I contracted.
3572.91|3585.79|we were contracting for the government here and they were building up and building up and building up and they almost had us out of business building up their own forces and until the government changed
3606.98|3624.51|we were contracting for the government here and they were building up and building up and building up and they almost had us out of business building up their own forces and until the government changed and then I was burnt out by that time and I quit just from the
3625.1|3631.83|But in other words, you got so that you didn't depend on the government for anything to provide any of the security.
3631.97|3638.88|So it didn't matter to you whether you had unemployment insurance or old age pension or all these kind of things then because you figured you would save and look after yourself.
3638.9|3641.85|I did that for myself because I'd always looked after myself, yes.
3643.21|3645.67|And I think we'd be better off if we had more of that now.
3646.21|3646.88|Well, I agree.
3646.89|3648.94|I think the government's taken over too much of that.
3649.0|3653.72|When a person comes to a job and the first thing he asks is, what's your pension system here?
3654.4|3657.28|He's looking for something to ride on right there.
3657.86|3662.67|Although a lot of the jobs now, you're not able to save, I don't think.
3663.09|3666.61|Well, then I'll use an old corny saying.
3666.67|3674.02|Today the problem is not the cost of living, it's the cost of the way we live is the big thing.
3674.06|3679.47|We all have our expectations so high, and you can get that way.
3679.87|3683.36|And the same person that is that way, if they had to, they could go back to the
3683.74|3691.33|The house with apple boxes and cans and pans just enough to get along with a human is a funny creature, you know.
3691.69|3696.22|You can do with luxury and you can do with the bare necessity.
3696.98|3698.78|I saw some of that during the Depression.
3698.82|3702.47|I saw a farmer just out of our hometown that always rode high and mighty.
3703.19|3712.2|When things got tough, he really got out and drove a team of horses in the field, wore overalls when he was a man 70 years old.
3712.3|3713.56|This was out of necessity.
3713.75|3722.78|He did it very humbly, and he was a better citizen in a small town then than when he was when he was riding high and mighty.
3723.24|3736.95|Were there very many people in a town who, like were there opportunists who took over other people's farms because they had the money, bought up property and businesses or anything like that?
3737.14|3741.34|I really never saw it in those days, not when I was...
3741.42|3745.72|So everybody in town was in the same fix and practice.
3745.74|3754.45|The only people, farmers, they would be mortgaged with a mortgage company, and I guess they still are today in the same way.
3754.47|3764.66|Maybe much worse today because it's so easy to get money today from the government and whatnot to keep agriculture alive.
3765.55|3773.94|Agriculture, as I see it, having lived here all my life, is a struggle from day one, and it's still a struggle.
3773.96|3774.98|It's going to be the same forever.
3775.0|3777.5|If you get on top and really make it.
3778.14|3785.27|All this high-priced land and everything, it's not that the land is worth that much.
3785.31|3787.81|It's people with so much money, they don't know what to do with it.
3787.83|3790.98|So they say, I'm going to go and buy a couple sections of land.
3791.6|3793.72|How big was the town that you were in?
3793.92|3798.69|Oh, when we came to Hallbright in 1907, it was about 700 people.
3798.77|3802.81|No, but in the 30s, when you were, where were you in the 30s?
3802.83|3805.86|Yeah, well, my deal was about 250 people.
3806.0|3810.2|That was my headquarters for a small town.
3810.22|3812.2|No, I didn't have general stores.
3813.51|3817.49|They had one general store.
3817.51|3819.01|You could buy a suit of clothes there, maybe.
3819.32|3821.28|So you did all your dealing right there in town?
3821.3|3823.76|Basically, you went to Waverton and asked them for those things.
3826.27|3828.43|Did they use the candles?
3828.45|3829.83|Did they use Eaton's candles?
3830.45|3830.63|Oh, yeah.
3830.65|3841.47|I saw Dad one time, about 19 or 20, had made up a big order for our winter clothes, you know.
3841.49|3846.48|And he went to town and came home, and here he had the order.
3847.2|3849.12|Everything, except one or two things.
3850.67|3853.43|And how could you get it so fast?
3854.21|3856.01|He said, "J.P. Shum took the order."
3856.03|3857.86|He said, I can sell that at that price.
3857.88|3864.08|He had a pretty good general store, including a fur coat in it.
3864.1|3866.03|Is that right?
3866.09|3868.63|Not a mink coat or anything, but a fur coat.
3869.05|3871.53|One of my older brother, he wanted a good warm overcoat.
3871.55|3877.22|He said, "I want this warm overcoat, maybe $39 or something."
3877.7|3879.16|What did all your family do?
3879.22|3884.33|Now, you said there were 13 of you, and you and your younger brother ran the farm.
3884.37|3886.38|Now, did the girls all marry off?
3886.52|3890.5|Well, I have to go back now to you say, why did Dad leave Iowa and come up here?
3891.5|3898.79|They had land promoters coming down there and saying the opportunity up in Camden.
3898.83|3905.8|They used to put on excursions, give them a free ride up into Canada, and I suppose lots of food and everything.
3906.46|3910.5|and drive them out in the country and say, here's the kind of land you can buy.
3910.52|3912.98|And it was virtually all prairie at that time.
3913.78|3916.25|There were some farms starting up.
3916.39|3918.13|And Dad had eight sons.
3918.69|3921.83|What do I want with this $80 an acre land in Iowa?
3921.89|3923.29|That's what farmland was worth.
3923.8|3925.2|Up here, he bought it for $20.
3926.84|3929.54|And I'll have a quarter section for each one of the sons.
3931.44|3933.66|Well, none of the sons stayed on the farm.
3934.55|3938.24|Okay, so now the older boys, they left before the Depression.
3938.26|3940.18|Yeah, the oldest boy, he left the first fall.
3940.2|3947.31|He became 21 in November, and he left and went back to the States, and he never came back up.
3947.33|3951.64|The second one, he was a year younger or something like that.
3952.8|3957.33|He left, he went, he homesteaded out by Okama, and then he went grain buying.
3957.37|3959.11|He spent his life as a grain buyer.
3960.27|3961.71|And the next one is John.
3962.92|3964.48|He tried farming.
3964.88|3970.35|And it didn't work out, so at that time, the big trek to California, so he goes to California.
3970.77|3972.01|Didn't know what he was going to do.
3972.65|3976.25|Charles, the next one, he follows up, he goes to California.
3976.29|3978.62|Joe, he left and he went to California.
3979.6|3981.96|And Sylvester, he got to be a schoolteacher.
3982.62|3984.7|He stayed in Saskatchewan.
3984.72|3986.19|And he is younger or older than you?
3986.35|3987.17|They're all older.
3987.21|3988.85|All older.
3989.43|3990.43|I'm the next one.
3990.93|3995.88|And I spent my life in Saskatchewan, you might say outside of two years in the States.
3996.94|4004.11|And then Milton, the eighth one, he was on the farm.
4004.67|4013.06|Well, he farmed but lived in town, but always, never farmed big, just enough to make a living and so on.
4013.73|4016.38|And the girls all married off, and they lived in Saskatchewan?
4016.4|4017.48|Two became nuns.
4017.92|4019.16|Just one married.
4019.46|4022.27|Second, one just younger than me, she married.
4022.91|4023.69|She died young.
4023.73|4026.92|She was only in her early 30s when she died.
4026.94|4029.32|California, she's in California.
4029.36|4031.13|California must have had a real attraction, eh?
4031.15|4031.61|It did.
4031.63|4034.17|I mean, John must have sent back some glowing stories.
4035.77|4037.87|I know it wasn't.
4037.89|4040.2|Yeah, I guess it was that good when he first went down.
4040.22|4042.22|And that's from the other Achen family.
4042.24|4044.76|There were nine girls and four boys in that family.
4044.78|4046.06|They lived just a mile away.
4046.22|4047.86|Now, what other Achen family is that?
4047.89|4048.87|That was my dad's brother.
4049.19|4050.21|Oh.
4050.25|4051.75|So they came up from Iowa together?
4052.49|4055.11|No, they came up five years after us.
4055.39|4056.89|After.
4056.91|4061.28|And so they migrated to California.
4061.3|4061.54|All of them?
4061.56|4065.64|Well, first the oldest girl, and then the mother, and the father,
4066.21|4070.9|And a pair of twins about 15 years old, and two more girls went down.
4071.06|4073.99|They all migrated, and they still sell them.
4074.01|4075.89|Is that right?
4076.34|4077.26|Three girls living.
4077.44|4082.61|One girl's in Arizona, and one in Victoria.
4082.63|4083.63|But it's funny.
4083.67|4084.73|They all scattered.
4084.77|4087.6|It didn't turn out the way Dad had it planned at all.
4088.64|4096.21|The other thing I was just thinking about, you said that you never had, single men never had a problem getting a job as opposed to married men.
4099.49|4107.71|No, because the company looked at it, here's a guy, you know, that he can be a migrant, and we don't want him, well, we can get rid of him.
4107.99|4110.17|If he's married, you have a responsibility.
4110.19|4116.76|I know this other lady was saying that she was a school teacher, and when she married, she had to quit.
4117.5|4120.18|They wouldn't have people who were married being school teachers.
4120.68|4122.32|Yeah.
4122.6|4125.97|Well, I run a business for 20 years, and I was the same.
4126.13|4127.97|I always hired single men.
4127.99|4128.47|Yeah, I suppose.
4128.49|4131.84|Do you remember the big truck that came through Regina?
4132.26|4135.44|All those young men who were unemployed, and they had them in the labor camp.
4136.02|4138.85|And they came here, and they had the riot.
4138.87|4139.77|Do you remember that?
4141.33|4143.41|Oh, yeah, I remember that there again.
4143.43|4147.22|But that was an accumulation of men right from Victoria through, you see.
4147.94|4152.08|They weren't from the district here or anything like that.
4152.1|4154.33|What did people think about it?
4154.35|4155.97|They didn't pay much attention to it.
4156.91|4157.39|The same.
4158.09|4163.98|I drove into Estevan after they had the big strike, the coal miner strike down there and shot two or three guys.
4164.48|4168.18|I drove into town and they had martial law on and I didn't know what was wrong.
4168.2|4171.0|It was so quiet, about five in the afternoon.
4171.47|4175.19|I stopped at a service station and the guy said, I said, what's happened, Jack?
4175.21|4176.17|There's nobody around.
4176.19|4176.63|He said, "
4177.3|4178.64|got martial law here.
4178.66|4181.81|He said, "It's just a big riot here this afternoon."
4181.83|4182.99|I hadn't heard a thing about it.
4183.91|4186.45|I didn't pay much attention to it either.
4186.47|4188.59|It was one of those things that happened.
4188.61|4194.22|So people really weren't in sympathy much with these people who went on strike then, were they?
4194.24|4199.9|Excepting the miners, because everybody else didn't pay too much attention to it.
4199.92|4202.79|Were there very many of the unions developed?
4202.81|4205.37|That's, yeah, they were developing unions.
4206.48|4207.34|at that time.
4208.58|4209.94|Were people enthusiastic?
4211.15|4211.67|Pardon?
4211.71|4214.13|Were people glad that this was happening, the unions?
4214.15|4215.37|Did they think they were a good idea?
4215.39|4217.61|No, they didn't pay much attention to it but the miners.
