start|end|text
1440.06|1441.04|The people themselves.
1441.4|1445.71|But you wire a house, they'd put in an entrance, which cost $18 in those days.
1445.77|1448.57|Now, to get that plug put in now, it cost you $25.
1448.59|1449.61|Yeah.
1449.66|1452.18|But I'd put in the main entrance coming into a house for $18.
1452.31|1455.09|And for $3, I'd put in an outlet or a light.
1456.19|1458.87|So they'd put in the very minimum.
1458.89|1462.18|If they had five rooms, they'd put in five lights.
1462.26|1463.0|That was $15.
1463.02|1464.96|And $18, that's only $33.
1465.0|1465.66|Yeah.
1466.66|1467.99|And did most people have it put in?
1469.67|1470.41|Pretty well.
1470.55|1475.44|I'd say 75% or 80% of the people, yes.
1476.86|1479.38|Doesn't sound like there's that .
1480.27|1485.48|There were some of the ones living in the small shacks, you know, and whatnot that didn't happen.
1485.5|1487.92|Did you know anybody that had to go on relief?
1489.39|1489.99|Oh, yes.
1491.01|1493.77|There were...
1493.79|1497.54|While this is... Later on, this carried on into...
1497.56|1507.93|When I got back into Estevan again in 1937, all kinds of people were living off relief, right up until the war.
1508.23|1513.94|Did people treat them any differently than, you know, did they look down on them because they were taking relief?
1515.96|1517.29|Not necessarily.
1517.33|1518.67|It was a thing you accepted.
1518.99|1519.89|That's the way it was.
1519.91|1524.86|And people living in, you know, a crowd into, like, you didn't live in a house like this.
1524.9|1529.46|Two people, you rented out every room to somebody if you only got $10 a month for it.
1529.48|1532.99|But to interject there for a minute, you said that people looked down on you if you were on relief.
1533.01|1536.67|No, because the lawyers, the only ones that weren't on relief were the bankers and the doctors.
1537.58|1541.43|The lawyers had the heels on their shoes going off, the same as everybody else.
1541.51|1542.53|My father objected to it.
1542.55|1546.89|He had to go down to the city hall to get his relief, but they delivered it to the lawyer's house.
1546.91|1547.99|Oh, is that right?
1548.02|1550.74|I mean, there was... Yeah, a difference.
1550.76|1551.12|A difference.
1551.14|1553.44|But everybody rented.
1553.48|1559.99|Like, again, I have to talk about Estevan and Bienfait, the coal mines where I knew every home.
1560.67|1566.86|I had 1,200 customers and knew them all, and they all knew me in the years that I was there.
1566.88|1567.38|And...
1568.68|1569.74|People were poor.
1570.32|1572.51|You were in sympathy with them.
1572.53|1580.81|I'd have to go and collect the light bills when they didn't pay, and the most heartbreaking thing, you'd go up to a door and pound on the door, and here's a woman come to the door.
1580.83|1588.44|She had three, four little kids trailing her there, and you're supposed to collect money because she was $5 behind on her light bill.
1588.94|1590.22|The government paid them $1.50.
1590.29|1590.79|On relief?
1593.15|1595.85|For lights, that was it, and anything over that they had to pay.
1596.78|1600.5|And that was one of the heartbreaking things, when you had to go out on collections.
1601.28|1613.32|And then, sure, we'd get the list, and here was some big shot in town with $70 or $80, and he wasn't on the list to go and collect from him.
1613.7|1615.52|Human nature being what it is.
1616.06|1618.57|But the relief came from the federal government, did it?
1619.63|1620.63|Federal, yeah.
1621.17|1622.57|Through the municipality?
1622.59|1626.06|Yeah, to get back to how did it affect you,
1627.37|1633.6|The one winter, the winter of 32, I had nothing to do, and my brother was home on the farm.
1634.36|1645.7|He said, "Well, I'll pay you this relief wage, which is $5 a month, is what the government used to pay, $5 a month for a man on the farm."
1645.72|1647.6|And he paid me $8 a month.
1647.62|1648.2|He gave me a bonus.
1648.24|1649.7|But I worked 12 hours a day.
1649.8|1651.78|We had a lot of livestock on the place.
1652.72|1653.4|I was busy.
1655.07|1656.99|Did you grow grain as well on the farm?
1657.41|1659.27|Oh, yeah, grain and livestock.
1659.29|1661.19|And did you always have good crops?
1661.91|1663.91|No, a lot of failures through the years.
1663.93|1666.28|So you had the drought down there as well.
1666.74|1668.1|Well, that came after.
1668.5|1674.78|The drought only came really after in the 30s when things started getting bad in that respect.
1675.2|1678.13|But by that time, I was away from farming.
1678.25|1679.67|It didn't affect you then?
1679.69|1679.75|No.
1679.77|1681.87|Do you remember what the price of wheat might be?
1682.05|1684.43|Yeah, I had some.
1684.49|1687.1|When that one year I farmed, I had
1688.07|1701.39|a few hundred bushels, and I guess I could have sold it that fall for maybe a dollar or something a bushel, and I thought I'll hold it, it'll go up, and I wound up selling it for about 60 cents a bushel.
1701.41|1704.37|The wheat went as low as 30 cents a bushel.
1705.96|1711.84|But that area obviously didn't get completely dried out because you said you had gardens, farm gardens.
1711.86|1712.97|Yeah, that's right.
1712.99|1717.99|You could always grow a garden, but I don't know how
1719.24|1722.68|The pastures were dried out.
1723.36|1725.16|You had to sell off your livestock.
1725.22|1727.95|The government wouldn't give you money if you couldn't grow hay.
1727.99|1733.29|The government wouldn't buy your hay, excepting for two cattle, two cows, that's all.
1733.31|1735.76|Things were tough in that respect.
1735.78|1739.18|And still, in our local area, there was not bad.
1739.96|1748.15|I was out west between Shaunavon and Assiniboia in 1935 and 1936, and there it was terrible.
1748.27|1749.11|And I might add
1750.39|1758.52|When I was at Rosetown in 1937, that's on the main road north from Swift Current, that people were migrating up there.
1759.28|1760.66|It was an endless stream.
1761.48|1762.38|Migrating out of that.
1762.5|1765.62|Out of the dry country down south of Swift Current going north.
1766.09|1769.91|You could go out on the highway and get up on a high area somewhere.
1770.35|1778.56|And as far as the eye could see, there'd be one of these hay racks with a cow behind it, maybe a Bennett buggy like you see pictures of there.
1779.45|1807.72|and about every half mile there'd be one of these and the whole family and up there while there'd be one of these and the whole family and up there
1808.07|1810.61|take the track up, they went up into the Meadow Lake County.
1810.63|1812.3|And a lot of them never came back, did they?
1812.32|1814.04|Oh, they did well up there.
1814.98|1823.51|In 1957, we built power lines up there, and these were the people that had migrated up there into the woods, had it all cleared out, and had beautiful farms.
1824.73|1833.07|Now, going back to the, who did people blame for the Depression?
1833.09|1833.69|Government.
1834.9|1835.56|But it wasn't.
1836.18|1841.27|See, Saskatchewan was not only hit with the Depression, we were hit with the drought, which made it doubly bad.
1841.57|1842.69|Right.
1842.71|1845.38|Did people, were people politically involved, do you think?
1846.78|1847.88|Well, where else do you go?
1847.9|1849.66|You blame the government, you know.
1849.84|1851.02|Where are you going to go for help?
1851.9|1857.05|You start with the municipal level, and then the provincial level, and finally it winds up in Ottawa.
1857.37|1861.18|No, no, but I meant, did people, were people...
1861.51|1862.95|Did they have political opinions?
1863.13|1866.34|The other lady I talked to said that people weren't politically aware.
1866.36|1866.88|Not like they are today.
1866.9|1867.9|They tended to be small town.
1868.1|1869.22|Because we didn't have this.
1869.82|1874.77|Well, yeah, we had radios, but I'd say only half of the families had radios.
1874.79|1876.09|I didn't say they blamed the government, Linda.
1877.39|1878.49|Well, that's what they said.
1879.39|1881.93|You can't blame the government because you can't grow anything.
1882.07|1888.5|Yeah, but all this bunch you see pictures of train loads when they come through Ejani are going down to Ottawa to raise hell.
1888.82|1894.16|blame the government because they weren't, well they didn't blame them for the drought, but they weren't getting anything for the farm.
1894.18|1898.73|But for the depression they were, for the crisis or something.
1898.75|1910.88|It was really, people were not as informed at that time as they are now.
1910.9|1915.03|And I say, God help us if it ever gets as bad now as it was then.
1915.63|1918.25|I'm afraid for what will happen.
1918.27|1919.71|Did they have any idea of how long?
1919.75|1921.39|Did people think it would last very long?
1922.84|1924.08|You never look ahead that far.
1925.12|1927.64|And I suppose because everybody was pretty well in the same predicament.
1927.66|1930.14|Everybody was in the same boat.
1930.2|1932.87|Farmers, you know, people were hard up.
1933.29|1937.65|I'll tell you where I noticed it most during the years.
1937.75|1944.13|Like I went to Iowa in 1931, and then I took my mother down again in 1938.
1945.85|1948.84|And when you got down there, there was no depression.
1949.32|1953.52|Well, financial matters, but people had everything.
1953.9|1957.59|When you went to church on Sunday, everybody was dressed so nice down there.
1957.89|1966.0|And here, when you went to church on Sunday, people were really dressed shabby in old coats and old clothes and everything.
1966.02|1966.68|It showed up.
1967.14|1970.86|But it never really did affect you as far as clothing and that kind of thing did?
1972.0|1973.79|One fellow told me, he said, "I always remember"
1974.2|1975.26|You was a young man.
1975.28|1976.37|He was about my age.
1976.77|1982.97|And then he went out back and he said, "The only thing I could ever remember about you, you were always kind of a sporty dresser."
1983.43|1984.98|Well, I didn't think I was.
1985.12|1986.58|You had just yourself to keep.
1986.72|1990.1|I thought I didn't have a winter overcoat for three years.
1990.28|1991.71|You were married in 1938?
1991.77|1995.13|What did you say?
1995.15|1995.25|1940.
1995.27|1995.75|1940.
1995.81|1998.91|So you were married then after the Depression.
1998.99|2000.4|Yeah, that was one of the things.
2000.53|2005.62|But I saw these fellows getting married during the Depression, and they didn't have anything in their home.
2005.64|2010.3|They'd get in an old house someplace and have apple boxes with curtains on and so forth.
2010.32|2015.73|Well, I was brought up in a good home, and I said, "I'd never want to marry a girl and take her into a deal like that."
2015.85|2021.12|And I didn't have the wherewith to start a home.
2022.1|2023.76|So you intentionally didn't marry then?
2023.88|2028.88|Intentionally didn't get married until I... Good job the depression didn't go on a long, long time.
2029.52|2031.38|A couple more years.
2031.98|2033.62|I had one brother who never did marry.
2033.79|2034.35|He's a schoolteacher.
2034.37|2035.55|For the same reason, I suppose.
2035.57|2037.05|Yeah, he was a schoolteacher.
2037.11|2038.73|He never had enough money to get married.
2038.75|2044.21|Well, this other lady I was interviewing said that a lot of people were engaged for a long, long time just because they couldn't afford to get married.
2044.23|2045.47|I had a brother who was engaged for eight years.
2045.49|2046.19|Is that right?
2047.08|2048.5|Just couldn't afford to get married.
2050.52|2052.0|The other thing I wanted to know was about
2052.25|2055.33|what they did with their spare time, what you did socially.
2057.98|2065.79|Well, it's funny, even before you've gone here, when you get older, you think about things that come back to me.
2067.73|2080.16|When I was home on the farm, again, in the wintertime you're tied up, about four of us neighbor young gang would get together and we'd
2080.9|2086.25|One house after the other would, this was stag, put on a party, stag party.
2087.23|2095.28|A couple of them were bachelors, the people were away on holidays, and we'd go there and play poker.
2096.32|2097.9|Used matches, a penny a match.
2098.1|2099.56|You didn't have that many pennies.
2100.62|2102.04|Sure, the Orsted boys.
2102.06|2104.81|The Orsted, a homemade beer?
2104.83|2106.53|No, we didn't drink at that time.
2106.59|2109.83|That was before beer came into being, before liquor came.
2110.22|2111.72|Those parties were dry.
2112.24|2115.52|Ice cream party and make cake and ice cream and all.
2115.54|2118.09|That's what we young fellas used to do.
2118.11|2122.19|And nobody made any, what do you call it?
2122.21|2123.03|Homebrew?
2123.05|2123.61|Yeah, homebrew.
2123.64|2124.86|No, not then.
2125.04|2126.58|Well, my dad always made wine.
2126.86|2128.84|My dad always made a barrel of wine every year.
2129.24|2129.68|And beer.
2130.95|2135.45|Well, then I started making beer, but that was in the 30s when we started making beer.
2136.01|2139.5|Yeah, in the years when I was home on the farm, we made our own beer.
2139.98|2145.85|two cents a bottle for Costas, and Costas made beer just as good as you buy today.
2145.99|2148.49|Is that right?
2148.51|2149.71|Yeah.
2149.73|2153.38|So, and what did other people do for entertainment?
2153.4|2155.32|You know, there must have been a lot of men who were on it.
2155.34|2157.64|Now, you're talking about the Depression years, not before.
2157.66|2159.95|Yeah, I just want the Depression.
2159.97|2161.51|Yeah, the Depression years.
2162.29|2163.69|You had schoolhouse dances.
2165.73|2168.82|As you know, every six miles through the country, there's a schoolhouse.
2168.84|2168.99|Right.
2169.26|2183.89|something like that, and a schoolhouse dance, and it would cost you 35 cents, and somebody put it on and paid the guy with the violin or the organ, whatever it was, and you had a lunch and everything for 35 cents.
2184.42|2186.94|That's more darn less than you could shake a stick at.
2187.02|2188.1|And I suppose everybody went.
2189.52|2192.72|Well, all the young people, oh, sure, they were all plugged.
2192.74|2197.65|No matter how cold it was or how much snow it was, you'd get there in the wintertime.
2198.78|2201.7|And then the small towns have a dance.
2201.76|2204.66|Maybe once a month you'd have a dance in your small town.
2204.68|2206.2|That was your entertainment.
2206.22|2208.23|And you had radio?
2209.65|2213.89|Yeah, we got a radio about 1923, I think, the first out.
2213.91|2222.64|I remember one dad, his dad came home one day with a radio with just headsets, and we used to put it in a bowl, and then we could all hear it.
2222.66|2224.13|In a bowl?
2224.15|2225.55|Open and amplify it, I suppose.
2225.57|2226.59|Yeah, like a big bowl.
2227.77|2230.47|But you had those big bowls, making bread.
2231.19|2235.14|Big ceramic bowl and put it in there and it echoed out.
2235.16|2238.04|That sounds like sitting under the towel to watch the TV.
2238.98|2242.39|I remember when they first came out, the TVs were so snowy and you couldn't see them.
2242.41|2243.65|You had to sit with a towel over.
2243.73|2246.25|No, I never experienced that.
2246.41|2251.68|Well, we're in the city here, we always have pretty good reception.
2252.14|2256.64|Yeah, radios come out, and you'd listen to David McKee and Molly.
2257.54|2259.32|You read, you did a lot of reading.
2260.63|2268.06|I've seen at home, when I was home on the farm that winter, everything was read in the house.
2268.18|2270.54|You didn't have a library like this, you know.
2270.56|2273.38|You'd get a book from the neighbor, and you'd read it.
2273.99|2274.73|Passable.
2276.11|2279.81|Did the men who were unemployed, did they have a problem with their spare time?
2281.09|2291.2|They went out, and there were, at that time, we probably had 80 or 90,000 farms in Saskatchewan.
2291.22|2296.55|And the farmer was paid $5 a month to keep this fellow out there.
2296.57|2300.79|So the farmer, if he had a room, he'd get one of these men out there.
2301.26|2302.08|And did they pay you?
2302.1|2304.34|And that fellow, he was lucky.
2304.36|2306.66|If he got the $5, you know,
2307.62|2308.52|But he got room and board.
2308.54|2309.32|The farmer got paid.
2309.34|2314.71|He got room and board, and he kept busy, you know, something to do.
2315.03|2319.86|And everybody else was doing the same thing, you know, so it wasn't that bad.
2320.82|2324.63|Do you know anything about what they did for medical care?
2326.65|2330.19|Was there any medical aid or things for these people?
2330.21|2333.6|I never knew of anyone dying excepting one woman, a neighbor woman.
2333.62|2335.6|I had about probably her.
2336.41|2344.66|tenth or twelfth baby, and she died from childbirth just a neighbor a couple of miles away.
2344.72|2349.41|Other than that, I never knew of anybody dying from want of medicine.
2349.63|2351.69|Did they have a doctor and a nurse?
2351.71|2355.78|We had a doctor at Griffin, which was ten miles away, but that wasn't our town.
2355.92|2360.28|Midale doctor was the one that would come out.
2360.3|2364.09|But for a doctor to come to the farm in the wintertime was almost unheard of.
2364.79|2366.71|So you did most of the doctoring yourself?
2367.07|2370.22|Oh, yeah.
2370.32|2372.78|I remember sticking a fork into my foot one time.
2373.3|2375.3|A few hours I had blood poison.
2376.45|2379.91|But you had some home remedy and it cured it.
2379.93|2382.65|So one of the more people didn't die?
2384.84|2391.16|I remember that one was hot coals in a pail and throw some wool rags and put a blanket over and put your foot in.
2391.57|2393.67|I don't know whether it's the heat or the smoke that
2394.07|2401.88|I remember doing, I stuck a nail in my foot and they had to soak it, so it was supposed to be the same thing.
2401.9|2403.7|Well, in fact, you didn't.
2403.91|2405.71|Yeah, well, it'd be contaminated.
2406.09|2409.53|I remember this was in the summertime, too.
2409.55|2411.1|I had an attack to appendicitis.
2411.12|2414.34|That was that summer when I was home on the farm about 33.
2414.94|2416.74|I was out pitching bundles folded over.
2416.76|2418.45|I had such a pain in here.
2418.47|2420.97|Later on, for a couple of days, one whole day later in
2421.49|2424.28|in bed putting cold irons on there.
2424.45|2426.06|That was supposed to be good for it.
2426.4|2427.54|Oh, it went away.
2427.58|2435.19|I've never had an operation of this game.
2435.43|2439.07|I never heard of anyone dying for want of medicine.
2439.65|2441.99|Did you have soup kitchens and that kind of thing in your town?
2442.2|2442.51|No.
2443.16|2444.08|It was too small.
2444.1|2444.4|No.
2444.86|2448.72|See, small communities had a big advantage.
2448.74|2450.82|Everybody sort of looked after everybody.
2451.24|2451.86|What, shared?
2452.47|2454.07|Food and that sort of thing?
2454.09|2455.07|Well, I don't know.
2455.11|2457.37|If you saw somebody that needed help, you helped them.
2457.99|2460.24|That was...
2460.26|2464.8|So you don't think the government did much, really, then, to alleviate any of the problems?
2464.82|2468.19|They didn't... Well, the municipalities handled it.
2469.83|2473.57|You could get help, financial help, from the municipalities.
2473.59|2476.4|Well, they sent in salt fish and apples.
2476.58|2477.84|Oh, yeah, the government sent... From the east.
2477.9|2478.6|From the east.
2479.15|2480.64|Did everybody get that?
2480.76|2482.3|Oh, yeah.
2482.8|2484.46|The mother said, I don't want any.
2484.54|2487.64|The storekeeper said, you get in there and get your box of apples.
2488.41|2489.41|You're entitled to it.
2489.43|2490.43|It's for everybody.
2491.01|2491.29|Is that right?
2491.31|2495.11|The mother, very reluctantly, took a box of apples.
2497.22|2498.8|If you are self-sufficient,
2500.06|2501.52|You lived on a farm.
2501.59|2503.23|You could basically survive.
2503.85|2504.25|You had a cow.
2504.27|2510.26|You maybe didn't have much money, but you could sell your eggs, you could sell your own chicken, you had your vegetables, you had your meat.
2511.34|2513.3|So you bought a little sugar and a little salt.
2514.07|2517.35|But if you lived in town, you were on relief, period.
2517.99|2520.66|But it goes back again.
2520.86|2525.66|The guy took 100 pounds of flour home and a half of pork for a couple of bucks and a
2526.71|2528.33|They got through the winter somehow.
2528.41|2534.18|But they didn't allow, I mean, anybody who owned a store didn't allow much credit, did they?
2534.2|2534.68|Oh, yeah.
2536.26|2536.54|They did.
2536.56|2539.84|They did up to a point where it would hurt them.
2539.86|2540.8|And then they cut them off.
2540.84|2541.97|Then they cut it off.
2542.91|2543.09|Yeah.
2543.23|2545.11|Small towns, small communities.
2545.71|2548.83|It was the same with neighbors.
2548.91|2556.24|We had neighbors, well, this was even before the Depression, that didn't have feed or anything for their animals, and we were
2556.95|2559.63|The guy wanted to know if he could get a load of straw.
2559.65|2562.91|Well, he came up there with a team of horses that could hardly pull the empty sleigh.
2563.88|2565.92|And they were so hard up for feed.
2566.6|2569.4|So Dad said to us, boys, go out and load them up a load of straw.
2569.42|2570.36|Brought it in.
2570.38|2573.63|Then he said to another one, he said, "Hitch a team of horses out and pull them home."
2573.65|2574.73|He was two miles away.
2575.59|2577.43|But you help people like that.
2577.61|2581.24|And maybe throw some oats in, too, so that he could feed his horses.
2583.04|2585.12|Looking awfully desperate for people, though.
2585.14|2586.26|You had big families.
2586.75|2587.35|No job.
2587.49|2588.85|It must have been terrible.
2588.87|2591.87|Of course, there again, as I said, our home never suffered that way.
2591.89|2593.72|We were one of the...
2593.74|2596.48|But you did help other people, didn't you?
2596.5|2597.44|Oh, yeah, you're sure.
2597.86|2599.34|I always helped other people.
2599.44|2603.85|So there was a sense of community and a sense of closeness more than there is now.
2603.87|2604.91|Oh, very definitely.
2604.93|2606.91|It was so different.
2606.93|2611.72|I can remember this neighbor lady that I got when Mother was sick.
2611.74|2612.98|And this after Dad was dead.
2613.78|2615.98|They were going to sell out and go back to Illinois.
2616.65|2617.83|And her son took sick.
2617.99|2618.97|She just had the one son.
2618.99|2619.84|He was about my age.
2621.02|2627.94|So she asked if I'd come up and get them ready for an auction sale, all their livestock and machinery and everything.
2627.96|2632.05|And I went up there and I worked like a slave, besides doing the chores at home.
2632.07|2633.23|And I'd go up and work there.
2633.25|2638.49|And I got all our horses trimmed up and dressed up for the sale and everything arranged.
2638.51|2640.68|Got neighbors in and we dug out the machinery.
2640.7|2645.68|And all the while, she kept saying, oh, Linda and I don't know what I'd do without you.
2646.18|2648.59|I will pay you a bell, she'd always say.
2648.61|2649.53|I will pay you a bell.
2649.81|2651.71|When I was all over, she'd give me a $5 bill.
2651.83|2653.95|I'd worked up there about 10 days.
2655.74|2657.34|But you felt good.
2658.18|2659.9|Well, it didn't hurt me.
2659.92|2660.12|No.
2660.52|2671.47|Another neighbor, almost in the same direction, he was a bachelor, and he got me to come and take his horses in off of the prairie and trim them up and everything.
2671.49|2673.38|He always used that term.
2673.4|2674.38|He's a Scandinavian.
2674.42|2675.18|I'll pay you a bell.
2675.2|2675.7|I'll pay you a bell.
2676.29|2680.77|He gave me a mahogany table about that big.
2680.79|2682.39|That was the pay I got for it.
2683.38|2688.56|So do you think, yeah, you think people did a lot of trading then?
2688.7|2695.73|Sort of like barter, rather than paying cash for things, they'd bring barter or whatever?
2695.83|2699.15|No, I never saw any of that go on in the small towns, really.
2699.39|2702.92|Well, the barber in Midale, he's still living.
2702.94|2704.34|He's over 100 years old.
2704.96|2706.1|He would do that.
2706.12|2718.07|He would trim hair for butter or cream or potatoes or eggs, what have you.
2718.09|2721.51|But you're out on the road and you had to pull in someplace for two or three hours.
2721.53|2722.83|You're afraid to be out on the road.
2723.43|2727.94|You couldn't see the length of a car in front of you.
2727.96|2729.86|And that would go on for days, I suppose, wouldn't it?
2729.92|2731.82|Day and night sometimes, yeah.
2731.84|2732.92|Did that affect people?
2735.08|2739.03|No, you got accustomed to being dirty all the time, you know.
2740.53|2745.75|I can remember working in Shaunavon in 1936.
2747.72|2751.74|And we were overhauling the power line that runs from Shaunavon to Assiniboia.
2752.22|2754.52|And we would go out every morning, a nice bright morning.
2756.03|2764.5|And by the time the sun got up good and it got hot, the wind would start up and by 11 o'clock in the morning you had a hit for cover.
2764.86|2767.71|It just seemed to create a draft, you know.
2767.73|2769.93|It'd come all the way from Lethbridge down.
2769.95|2772.34|The whole country was like a desert.
2773.72|2775.58|And they said, "Well, it's finished."
2775.6|2777.07|It'll never grow anything again.
2777.11|2780.35|The whole country is just... Gophers starved to death.
2780.43|2781.19|It was that bad.
2782.03|2783.32|Birds starved to death.
2783.44|2785.36|Yeah, because nothing grew, I guess.
2785.48|2788.97|Nothing grew except in Russian thistles, and they'd get about so high.
2790.73|2792.16|But it did rain sometimes.
2792.36|2795.92|Well, and it started raining, and they grew 20 crops in a row after that.
2795.94|2797.6|Well, of course all of that was just shifting.
