start|end|text
4218.69|4222.64|Anybody who didn't have anything much, they were the ones who were moral sort of ones.
4222.66|4222.92|Yeah.
4222.94|4229.09|Well, the miners were getting a bad deal, there's no doubt about it, but things were tough, I mean, for the mine company to make it go to.
4230.63|4232.35|Were there many people who were communists?
4233.7|4262.83|well they they said the guy that come in there this uh annie buller she's a woman from winnipeg and what was the other fellow's name the ringleader, they said, "He's a communist but he was making a living organizing that was same as all these uh this mcdermott we have down in ottawa now he's got a job to do he's got a holler and castigate all the big companies and everything for treating his men so bad how does he earn a hundred thousand a year if you don't"
4263.64|4271.24|So it sounds like that anybody who was sort of making go of it, they didn't bother politically or they weren't involved in the unions.
4271.3|4273.77|They were just glad to be left alone.
4273.79|4279.43|It was only the people who were really, really hurting or on relief that sort of got involved in those kind of things, were they?
4280.57|4282.57|Well, I don't know.
4283.66|4292.65|See, just when I left the company to go contracting, they were trying to organize a union in our company, the power company next to them.
4293.27|4296.61|And the organizer who sat down there, I couldn't agree with him at all.
4297.23|4300.55|All he was getting was so much for signing up.
4302.73|4307.04|And if you want $5 an hour, we'll get it for you.
4307.08|4308.04|That was his song.
4308.18|4309.32|He made lots of promises.
4309.34|4311.82|I said, "How can you give us $5 an hour?"
4311.96|4315.95|This company's having a hard time staying alive and paying us $1 an hour.
4315.97|4316.69|When would this be?
4316.79|4318.87|What year?
4318.89|4322.31|It was in 45, 44.
4322.9|4326.86|And so it was after the war.
4326.88|4326.98|Yeah.
4327.0|4330.51|And with the result of it, they never did get organized.
4330.55|4335.27|The company was taken over by the government.
4335.29|4340.58|About 46, I think, companies taken over.
4340.96|4343.0|Well, I can't think of anything else I have to ask you.
4344.08|4345.9|Unless you can think of anything else I should know.
4346.27|4349.37|It doesn't sound like the Depression was that bad.
4349.67|4351.27|Listen, you can't go by Lindy.
4351.6|4353.25|I'm going to interview you too.
4353.29|4356.03|Because he was one of the affluent type.
4356.07|4363.95|He doesn't tell you his mother sold the chickens for five cents a chicken, all that kind of stuff, or that they went without food, or they went without clothes.
4364.39|4366.85|He doesn't tell you any of that stuff because he lived on a farm.
4368.21|4369.66|He doesn't know what the Depression was.
4370.98|4374.73|But I think it was very individual type of thing, the Depression was, wasn't it?
4391.51|4396.62|Yeah, sure, they had food.
4396.64|4399.06|Now, you said you were at university, right?
4399.74|4399.88|Mm-hmm.
4400.32|4402.6|And your sisters were at home, were they?
4402.62|4406.09|My oldest girl was teaching at that time at Winery Prairie.
4407.41|4409.81|She finished normal in B.C.
4409.89|4411.95|in 28.
4411.97|4413.75|And then she went up to Coos Coupe.
4414.23|4417.08|Coos Coupe, where you got?
4417.12|4421.3|She got there for a few years, and then in the top years, then she was gone.
